<?xml version="1.0" encoding="utf-8"?>
<imobiliaria xmlns="http://imobiliaria.org"
    xmlns:xsi="http://www.w3.org/2001/XMLSchema-instance" 
    xsi:schemaLocation="http://imobiliaria.org 
                           imobiliaria.xsd">

    <imovel>
        <descricao>Apartamento moderno com ótima localização</descricao>
        <proprietario>
            <nome>João Silva</nome>
            <email>joao@gmail.com</email>
            <telefone>1199999-0000</telefone>
            <telefone>1198888-1111</telefone>
        </proprietario>
        <endereço>
            <rua>Rua das Flores</rua>
            <bairro>Centro</bairro>
            <cidade>São Paulo</cidade>
            <numero>100</numero>
        </endereço>
        <caracteristicas>
            <tamanho>85</tamanho>
            <numQuartos>3</numQuartos>
            <numBanheiros>2</numBanheiros>
        </caracteristicas>
        <valor>550.000</valor>
    </imovel>

    <imovel>
        <descricao>Casa espaçosa com quintal amplo</descricao>
        <proprietario>
            <nome>Maria Oliveira</nome>
            <telefone>1197777-2222</telefone>
        </proprietario>
        <endereço>
            <rua>Rua das Acácias</rua>
            <bairro>Jardim das Flores</bairro>
            <cidade>Campinas</cidade>
            <numero>450</numero>
        </endereço>
        <caracteristicas>
            <tamanho>250</tamanho>
            <numQuartos>4</numQuartos>
            <numBanheiros>3</numBanheiros>
        </caracteristicas>
        <valor>750.000</valor>
    </imovel>

    <imovel>
        <descricao>Kitnet prática e bem localizada</descricao>
        <proprietario>
            <nome>Pedro Santos</nome>
            <email>pedro_santos@hotmail.com</email>
        </proprietario>
        <endereço>
            <rua>Rua Principal</rua>
            <bairro>Centro</bairro>
            <cidade>Curitiba</cidade>
        </endereço>
        <caracteristicas>
            <tamanho>35</tamanho>
            <numQuartos>1</numQuartos>
            <numBanheiros>1</numBanheiros>
        </caracteristicas>
        <valor>180.000</valor>
    </imovel>

    <imovel>
        <descricao>Apartamento de luxo com vista para o mar</descricao>
        <proprietario>
            <nome>Ana Paula</nome>
            <email>anapaula@gmail.com</email>
            <telefone>2196666-3333</telefone>
        </proprietario>
        <endereço>
            <rua>Av. Atlântica</rua>
            <bairro>Copacabana</bairro>
            <cidade>Rio de Janeiro</cidade>
            <numero>1500</numero>
        </endereço>
        <caracteristicas>
            <tamanho>200</tamanho>
            <numQuartos>3</numQuartos>
            <numBanheiros>4</numBanheiros>
        </caracteristicas>
        <valor>2.500</valor>
    </imovel>

    <imovel>
        <descricao>Sobrado aconchegante com garagem</descricao>
        <proprietario>
            <nome>Carlos Mendes</nome>
            <telefone>1195555-4444</telefone>
        </proprietario>
        <endereço>
            <rua>Rua das Palmeiras</rua>
            <bairro>Vila Nova</bairro>
            <cidade>Porto Alegre</cidade>
            <numero>321</numero>
        </endereço>
        <caracteristicas>
            <tamanho>120</tamanho>
            <numQuartos>3</numQuartos>
            <numBanheiros>2</numBanheiros>
        </caracteristicas>
        <valor>480.000</valor>
    </imovel>
</imobiliaria>
